[
  {
    "slug": "designing-ui-skill--platform-detection",
    "epic": "Superpowers Skills",
    "feature": "designing-ui skill",
    "title": "Platform detection",
    "description": "Auto-detect the target platform (web-electron-ts vs other) from project files, scaffold-design.md, or human input before any UI design steps run.",
    "status": "open",
    "spec": "features/designing-ui-skill/design.md",
    "plan": null,
    "created": "2026-07-31",
    "completed": null
  },
  {
    "slug": "designing-ui-skill--figma-layout-capture",
    "epic": "Superpowers Skills",
    "feature": "designing-ui skill",
    "title": "Layout capture via Figma reference",
    "description": "Read a Figma file or node via get_metadata and get_screenshot to capture structural layout and visual reference for component mapping.",
    "status": "open",
    "spec": "features/designing-ui-skill/design.md",
    "plan": null,
    "created": "2026-07-31",
    "completed": null
  },
  {
    "slug": "designing-ui-skill--reui-component-mapping",
    "epic": "Superpowers Skills",
    "feature": "designing-ui skill",
    "title": "ReUI component mapping",
    "description": "Map each layout section to a free-tier ReUI component via the ReUI MCP search tool; flag unmatched sections as gaps without silent substitution.",
    "status": "open",
    "spec": "features/designing-ui-skill/design.md",
    "plan": null,
    "created": "2026-07-31",
    "completed": null
  },
  {
    "slug": "designing-ui-skill--design-doc-and-roadmap-output",
    "epic": "Superpowers Skills",
    "feature": "designing-ui skill",
    "title": "Design doc and roadmap output",
    "description": "Write design.md, design.html companion, roadmap.json entries, and ROADMAP.html after approval; hand off to writing-plans as the terminal state.",
    "status": "open",
    "spec": "features/designing-ui-skill/design.md",
    "plan": null,
    "created": "2026-07-31",
    "completed": null
  },
  {
    "slug": "designing-ui-skill--brainstorming-injection",
    "epic": "Superpowers Skills",
    "feature": "designing-ui skill",
    "title": "Brainstorming injection point",
    "description": "Detect a user-facing surface after Architecture approval in brainstorming and invoke designing-ui as a sub-flow; brainstorming then calls writing-plans once with both spec paths.",
    "status": "open",
    "spec": "features/designing-ui-skill/design.md",
    "plan": null,
    "created": "2026-07-31",
    "completed": null
  },
  {
    "slug": "designing-ui-skill--project-kickoff-injection",
    "epic": "Superpowers Skills",
    "feature": "designing-ui skill",
    "title": "Project-kickoff injection point",
    "description": "Detect a FrontEnd stack from Phase 2 Stack answer in project-kickoff and invoke designing-ui as a sub-flow for the initial UI shell; project-kickoff then calls writing-plans once with both spec paths.",
    "status": "open",
    "spec": "features/designing-ui-skill/design.md",
    "plan": null,
    "created": "2026-07-31",
    "completed": null
  },
  {
    "slug": "worktree-at-brainstorming--branch-worktree-created-at-brainstorming-start",
    "epic": "Developer Workflow",
    "feature": "Branch-per-feature SDLC",
    "title": "Branch/worktree created at brainstorming start",
    "description": "Create an isolated feature branch and worktree after context exploration and the scope check so the spec, plan, and implementation land on one branch.",
    "status": "released",
    "spec": "features/worktree-at-brainstorming/design.md",
    "plan": null,
    "created": "2026-08-01",
    "completed": "2026-08-02"
  },
  {
    "slug": "worktree-at-brainstorming--resume-in-progress-feature-branch",
    "epic": "Developer Workflow",
    "feature": "Branch-per-feature SDLC",
    "title": "Resume an in-progress feature branch in a fresh session",
    "description": "Reuse an existing unmerged feature branch and worktree that matches the slug instead of creating a duplicate in a fresh session.",
    "status": "released",
    "spec": "features/worktree-at-brainstorming/design.md",
    "plan": null,
    "created": "2026-08-01",
    "completed": "2026-08-02"
  }
]
